original_text,perturbed_text,defended_text,defended_outcome,original_label,defended_prediction
"@USER , ich glaube,Sie verkrnnen gründlich die Situation. Deutschland mischt sich nicht ein, weil die letzte Einmischung in der Ukraine noch nicht bereinigt ist. Es geht nicht ums Militär","@USER , ich glaube,Sie verkrnnen gründlich die Sotuation. Deutschland mischt sich nicht ein, weil die letzte Einmischung in der Ukraine noch nicht bereinigt ist. Es geyt niQcht ums Militär","@USER , Ich glaube,Sie verkrnnen gründlich Die Situation. Deutschland mischt Sich nicht ein, weil Die letzte Einmischung In DER Ukraine Noch nicht bereinigt ist. Es Tage Nicht ums Militär",SUCCESSFUL,LABEL_0,LABEL_0
"@USER: Man kann natürlich immerzu dieselbe Sau durchs Dorf treiben. Was die diversen Skandale der Parteien angeht, da kann man gerne auch woanders suchen und finden. Die Ära Kohl lässt grüßen oder auch die Amigo Affäre. Das Hunderte Millionen verschoben wurden, stimmt so nicht unbedingt. Die ""Realität"" ist eine etwas andere. Man sollte evtl. auch mal zur Kenntnis nehmen, dass kaum noch ""SED/PDS"" Funktionäre mitmischen. Das ist genauso abwegig wie der SPD immer noch Hartz IV vorgehalten wird, obwohl nur noch vereinzelt Politiker dort existieren, die mitgemischt haben. Außerdem lehnen die Linken Parteispenden ab, ebenso stimmen sie (wie auch die Grünen) gegen Diätenerhöhungen und spenden diese. Fragt sich nur wie das zusammenpasst mit der Mär der nimmersatten SED Nachfolgepartei. https://www.mdr.de/zeitreise/sed-vermoegen-100.html","@USER: Man kann natürlich immerzu diwselbe Sau durchs Dorf treiben. Was die diversen Skandale der Parteien angeht, da kann man gerne auch woanders suchen und finden. Die Ära Kohl lässt grüßen oder auch die Amigo Affäre. Das Hunderte Millionen verschoben wurden, stimmt so nicht unbedingt. Die ""Realität"" ist eine etwas andere. Man sollte evtl. auch mal zur Kenntnis nehmen, dass kaum noch ""SED/PDS"" Funktionäre mitmischen. Das ist genauso abwegig wie der SPD immer noch Hartz IV vorgehalten wird, obwohl nur noch vereinzelt Politiker dort existieren, die mitgemischt haben. Außedrem lehnen die Linken Parteispenden ab, ebenso stimmen sie (wie auch die Grünen) gegen Diätenerhöhungen und spenden diese. Fragt sich nur wie das zusammenpasst mit der Mär der nimmersatten SED Nachfolgepartei. https://www.mdr.de/zeitreise/sed-vermoegen-100.html","@USER: Man kann Natürlich immerzu dieselbe Sau durchs Dorf treiben. Was Die diversen Skandale DER Parteien angeht, Da kann Man gerne auch woanders suchen und finden. Die Ära Kohl lasst grüßen Oder auch Die Amigo Affäre. Das Hunderte Millionen verschoben wurden, stimmt so nicht unbedingt. Die ""Realität"" Ist Eine etwas andere. Man sollte evtl. auch Mal zur Kenntnis nehmen dass kaum Noch ""SED/PDS"" Funktionäre mitmischen. Das Ist GEnauso abwegig Wie DER SPD Immer Noch Hartz IV vorgehalten wird, obwohl nur Noch vereinzelt Politiker Dort existieren, Die mitgemischt haben. Außerdem lehnen Die Linken Parteispenden ab, ebenso stimmen sie (wie auch Die Grünen) gegen Diätenerhöhungen und spenden diese. Fragt Sich nur Wie Das zusammenpasst mit DER Mär DER nimmersatten SED Nachfolgepartei. https://www.mdr.de/zeitreise/sed-vermoegen-100.html",SUCCESSFUL,LABEL_0,LABEL_0
"Als jemand, der im real existierenden Sozialismus aufgewachsen ist, kann ich über George Weineberg nur sagen, dass er ein Voll...t ist. Finde es schon gut, dass der eingeladen wurde. Hat gezeigt, dass er viel Meinung hat, aber offensichtlich wenig Ahnung. Er hat sich eben so gut wie er kann, für alle sichtbar, zum Trottel gemacht.","Als jemand, der im real existierenden Sozialismus aufgewachsen ist, kann ich über George Weineberg nur sgaen, dass er ein Voll...t ist. Finde es schon gut, dass der eingeladen wurde. Hat gezeigt, dass er viel Meinung hat, aber offensichtlich wenig Ahnung. Er hat sich ehen so gut wie er kann, für alle sichtbar, zum Trottel gemacht.","Als jemand, DER Im real existierenden Sozialismus aufgewachsen ist, kann Ich Über George Weineberg nur sagen, dass er ein Voll...t ist. Finde es Schon Gut, dass DER eingeladen wurde. Hat gezeigt, dass er viel Meinung hat, aber offensichtlich wenig Ahnung. Er Hat Sich nahe so gut Wie er kann, Für alle sichtbar, zum Trottel gemacht.",SUCCESSFUL,LABEL_1,LABEL_1
"Sobald klar ist dass Trump die Wahl gewinnt liegen alle Deutschen Framing Journalisten im Sauerstoffzelt. Wegen extremer Schnappatmung. Das ist zwar hart, aber Fair!","Sobald klxr ist dass Trump die Wahl gewinnt liegen alle Deutschen Framing Journalisten im Sauerstoffzelt. Wehen extreker Sdhnappatmung. Das ist zwar hart, aber Fair!","Sobald Klar Ist dass Trump Die Wahl gewinnt liegen alle Deutschen Framing Journalisten Im Sauerstoffzelt. Wahlen extremer Schnappatmung. Das Ist zwar hart, aber Fair!",SUCCESSFUL,LABEL_1,LABEL_1
"@MEDIUM ...stimmt so nicht ganz: bespiel ""kleine eiszeit"" 1300-1900 und ""mittelalterliches klimaoptimum"" 950-1250 ...da spielte das klima offenbar ebenfalls ""verrückt""🤨","@MEDIUM ...stimmt so nicht ganz: bespirl ""kleine eiszeit"" 1300-19h00 und ""mittelalterliches klimaoptimum"" 950-2150 ...da spieote das klima offenbr ebenfalls ""verrückt""🤨","@MEDIUM ...stimmt so nicht ganz: bespiel ""kleine eiszeit"" 1300-1900 und ""mittelalterliches klimaoptimum"" 950-1250 ...da spielte Das klima offenbar ebenfalls ""verrückt""🤨",SUCCESSFUL,LABEL_0,LABEL_0
