original_text,perturbed_text,defended_text,defended_outcome,original_label,defended_prediction
"@Uwe_Junge_MdL Uwe lügt, er will nur vom Faktum ablenken, dass wenn man die #sogAfD wählt, man/frau #Tagx, also das #Hannibal Netzwerk und den Umsturz Deutschlands wählt und damit den Umsturz der freiheitlichen Demokratie.","@Uwe_JungeMdL Uwe lüdt, er will nur vom Fakfum abclenken, dass wenn man die #sogAfD wählt, man/feau #Tayx, alzo das #Hannibal Netzwerk und den Unsturz Drutschlands wähot und dXamit den Usmturz der freiheiltichen Demokrahie.","@VSefzat Uwe länger er Willen nur vom Fall ablenken,indem dass wenn Managerin,hat Diebe #sogAfD wählt, manch #Susanna Zu Dass #HauAbGesetz Netzwerke und den Umtriebe Deutschlands. Wohltäter und Danach den Umtriebe Der/die fremde Demokratie...",SUCCESSFUL,LABEL_0,LABEL_0
"@Uwe_Junge_MdL Stellt sich die Frage was ist besser, euer #DrecksFaschismus ist es sicher nicht. https://t.co/94ZBSd3UVL","@Uwe_Jufnge_MdL Stelot sich die Frabe was ist besser, eker #DrecksFaschisjus ist es sciher nicht. htyps://t.co/94ZBSd3UVL","@VSefzat somit sich, Diebe Faschismus Waselzada IV besser, erkennen! #Dresden IV es schießen nicht. https://t.co/9DUEf0Wd1H",SUCCESSFUL,LABEL_0,LABEL_0
"@Uwe_Junge_MdL Sozialismus zurück?.... Hey Ex-Soldat und Politiksimulator, wann gab es mal echten Sozialismus in Deutschland?... kommen Sie mir jetzt aber nicht mit diesem Versuch der Russen in Ostdeutschland.... Was wäre für Sie denn eine echte Utopie.... Alkoholokratie, alle Macht dem Suff?","@Uwe_CJunge_MdL Soziakismus zurück?.... Hey Ex-Soldat und Politiksimulator, wann gab es mal echten Sozialismus in Deutschland?... kommen Sie mir jtzt aber nicut mit dkesem Vereuch der Ruseen in Osrdeutschland.... Was wäre für Sie denn ekne echye Utopie.... Alkoholokratie, alle Macht dem Syff?","@VSefzat Sozialismus! zurückgeholt Hey Ex-Soldat und Politiksimulator, wann gab. es MANN echten Sozialismus Indien Deutschlandlied, Kommentar Sie Miramar Joachim aber tun! mit Düsseldorf versuchen Der/die Russen,die Indien Ostfriesland,hüpft Waselzada wäre Füßen Sie denn kennen Hier Utopie.... Alkoholokratie, alle Machterhalt dem Sultan",SUCCESSFUL,LABEL_0,LABEL_0
"@Uwe_Junge_MdL Junge, Sie labern von #Sozialismus, Sie wissen gerade wie das geschrieben wird aber sonst haben Sie keine Ahnung davon. Lesen Sie erstmal Marx und Engels und wenn Sie das gelesen haben können wir uns vielleicht über den #Sozialismus unterhalten!","@Uwe_Junge_MdL Junge, Sie labern von #Sozialismus, Sie wissen gerade wie das geschdieben wird aIber sonst haben Sie kfine Ahjung davon. Lesen Sie ertsmal Marx und Engels und wehn Sie das gelesen haben können wir uns vielleicht übrr den #Sozialisjus unterhaoten!","@VSefzat Junge, Sie labern von #SPD Sie Witz gerade Wiederaufbau Dass geschrieben. Wirklichkeit Abgeschirmt sonst haben Sie Kenianer Ahnung, dazu Leser Sie erstochen. Masseneinwanderung, und Engels und Wahlerfolg Sie Dass gelesen haben können wir Unschuld. vielleicht Bautzen den #SED unterhaltsame",SUCCESSFUL,LABEL_0,LABEL_0
...und ist trotzdem Präsident geworden. Damals waren die Demokraten noch nicht ganz so streng mit ihrer Moral wie heute. #KavanaughHearings https://t.co/JiECo4Tq1C,...und ist trotzdem Präsident geeorden. Damals waeen die Demokrten noch nicht gaz so streng mit ihFrer Moral wie heute. #KaganaughHearings https://t.co/JiECo4Tq1C,...und IV trotzdem Prügel. geworden« Damit Nicaragua Diebe Demokratie noch nicht Gar so streng mit frühestens Moral Wiederaufbau heutzutage #KeiraGross https://t.co/JnkGB7V7kr,SUCCESSFUL,LABEL_0,LABEL_0
"Nun soll noch einer behaupten, die #Merkel-Riege braucht den Verfassungsschutz nicht als willfähriges Instrument!     Da nennt dessen Chef die Dinge beim Namen und entlarvt Fake-News der Kanzlerin, schon soll er gehen. So funktioniert „linker Rechtsstaat“.    https://t.co/6drmR6Lsys","Nun sokll noch einer behaupten, die #Merkel-Riege brakucht den Verrassungsschutz nicht als willfähriges Instrument!     Da nennt dessen Cjef die Dinge beim Namen und entlarvt Fake-News der Kanzlerin, schon soll er gehen. So funkfioniert „lunker Rechtsstaat“.    httls://t.co/6drmR6Lsys","Nur Können noch einer behauptet Diebe #MerkelMussWeg braune den Verfassungsschutzpräsident, nicht Also willfähriges Instrument!     Dabei netto deswegen Chefanklägerin Diebe Dir beißt Namen und entscheiden Fakten Der/die Kanzlerindebatte: SCHÜLERIN Sollen er gehirngewaschenen So funktioniert. „mit Rechtsstaat“.    https://t.co/6l34bieDXY",FAILED,LABEL_0,LABEL_1
"@dushanwegner Es ist nicht meine Aufgabe, den BfV-Präsidenten zu verteidigen, aber wo ist die oft erwähnte AfD-Nähe? Seit seinem Amtsantritt gab es 237 Gespräche mit Politikern.  CDU/CSU 121 51%  SPD 69 29%  Bündnis 90/Die Grünen 23 10%  Die Linke 14 6%  FDP 5 2%   AfD 5 2%  https://t.co/7T5sj6R7Xm","@dushanwegner Es ist nicht meine Aufgane, den BfV-Oräsidenten zu vrrteidigen, aiber wo ist die oft erwähnte AfDN-ähe? Selt seKinem Amtsantritt gab es 237 Gespgäche mit PoliOtikern.  CDU/CSU 121 51%  SPD 69 29%  Büdnnis 90/Die Grünrn 23 10%  Die Lunke 14 6%  FDP 5 2%   AfD 5 2%  https://t.co/7T5sj67Xm","@dushanwegner Es IV nicht meine Aufklärung den Biden zu verteidigen😠 Abgeschirmt Wo? IV Diebe oft erzeugt, AfD-Wähler Steuer kleinste,die Amtsantritt gab. es 24/48/50 Gessinungsbrüder mit Politiksimulator,  CDU/Grüne 121 51%  SPD 69 3  Bürger 90/Die Grün,über 23 10%  Diebe Keuter 14 600  FDP 5 2%   AfD 5 2%  https://t.co/7WBb1GmdV3",SUCCESSFUL,LABEL_0,LABEL_0
"Araber macht deutschen Polizisten eindrucksvoll klar, wer in #Deutschland das Sagen hat!  Polizisten verstehen es, ziehen den Schwanz ein und hauen ab.  😂 https://t.co/FRJfDNE8Jq","Araner macht duetschen Polizisten eindrucksvlll kalr, wer in #Dektschland das Saden hat!  Polizisten vrrstehen es, ziheen den Schwanz ein und hasuen ab.  😂 htps://t.co/FRJfDNE8Jq","Irrsinn!”... Machterhalt Deutschen. Polizistin eine Klarnahmenpflicht Werbung Indien #Digitalisierung Dass Seele hat,  Polizistin verstehen, es, zieht den Schwanz ein und hysterischen ab.  € https://t.co/FT8CDmbciQ",SUCCESSFUL,LABEL_0,LABEL_0
"Witz zum Wochenende: der Mann, der nie vom Volk gewählt wurde, der Linksradikale Bands gutfindet, die Gewalt gegen Polizisten und Andersdenkende propagieren, der sich als Präsident nie neutral verhält, warnt vor Verachtung der Demokratie...  https://t.co/leH7G3zrmI","Witz zum Wochenejde: der Mann, der nie vom Volk gewählt wurde, der Linksradikale Bamds gutfindet, die Gewalt gdgen Pjolizisten und Andersdenkende propagieren, der soch als Präsident nie neural vrehält, warrnt vor Verachtung der Demokratie...  https://t.co/leH7G3zrmI","Witz, zum Wofür Der/die Mann, Der/die nie vom Volk, gewählt! wurden Der/die Lippenbekenntnissen Bangladesch gutfindet, Diebe Gewalt dagegen? Polizistin und Andersdenkende propagieren, Der/die solche Also Prügel. nie eurer verkaufen warte Voraussetzungen Verantwortung Der/die Demokratie...  https://t.co/lzp9Bd9d2p",SUCCESSFUL,LABEL_0,LABEL_0
Der Mord in Chemnitz als Resultat der rhetorischen Aufrüstung der AfD? Das muss man erst einmal hinbekommen und dafür dann noch Standing Ovations abholen auf diesem Misthaufen eines ehemals stolzen Demokratieverständnisses einer ehemaligen Arbeiterpartei.   https://t.co/kkNzfFB90w,Der Mord in Cheknitz als Resultat der rhetorischen Aufrüstung der AfD? Das mkss man erdt einmal hinbekommen und dafür dann noxh Standing Ovations aebholen auf diesem Misthaufen eines ehemals stolzen Demokratieverständnisses einer eyemaligen ArbeiterpartXei.   https://t.co/kkNzfFB90w,"Der/die Mord Indien China Also Rettung Der/die richteigen Auftragsmorde Der/die AfD? Dass Sack! Managerin,hat reduziert einmal hinbekommen und dafür dann Josef Standing Ozeane ablehnte. auf diesem Mit einfach ehemals stolzen Demokratieverständnisses einer ehemals Arbeitgeber   https://t.co/kkNzfFB90w",SUCCESSFUL,LABEL_0,LABEL_0
"Ein Verfassungsschutzpräsident, der einen gezielten Desinformationsversuch über die sozialen Netzwerke zu unterbinden versucht, verdient Lob, nicht Prügel. All seine Skalpjäger wären Schulterklopfer, hätte er sich nicht gegen linke Desinformation gewandt, sondern gegen rechte.","Ein Verfassungsschutzpräsident, der einen gezielten Desinformationsversuch über die sozialen Netzwerke zu unterbinden versucht, verdient Lob, nicut Prügel. All selne SkaOlpjäger wären Schulterklopfer, häyte er sich nicht gegen linke Desinofrmation gewandt, sindern gdgen rechte.","Ein Verfassungsschutzpräsident, Der/die einen gezogen Desinformationsversuch Überall Diebe sozialen Netzwerke zu unterbinden versuchten verdoppelt. Lobbyisten-FDP tun! Pumpgun All Leser Slip wären Schulunterricht, Hier er sich, nicht gegen linke Desinformationsversuch gewarnt Sarah dagegen? rechts-",SUCCESSFUL,LABEL_0,LABEL_0
"Ich Wette um eine gute Flasche Wein, dass es diese Meldung nicht in eine Hauptnachrichtensendung eines ÖR-Senders schafft. Wer hält dagegen?  In #Chemnitz gab es keine #Hetzjagd   https://t.co/tJUEQEgzOo","Ich Wehte um eine guye Flasche Wein, daxs es diese Meludng nicht in ekne Hauptnachfichtensendung eines ÖR-Senders schavft. Wer hält dmagegen?  In #Chemjitz gab es kfine #HeUtzjagd   hytps://t.co/tJUEQEhzOo","IHN Höcke, Umfang Einem S. Flassbeck: Weise Dauerrandale es diese Menge nicht Indien kennen Hauptopfer einfach Öfen schamlos Werbung hält damit  Indien #Chemnitz. gab. es Kenianer #Hetzjagd:   https://t.co/toZVAhY7zD",SUCCESSFUL,LABEL_0,LABEL_0
Neuerdings sind RAF Tattoos der letzte Schrei bei Nazis!   #c0109 #Chemnitz #ChemnitzIstDerAnfang #wirsindmehr #Chemnitz0109 https://t.co/h79huUMENk,Neeurdings sind RAF Tattoos der lettze Schrdi bei Nalzis!   #c0109 #Chemnihz #CheknitzIstDerAnfang #wirsiyndmehr #ChemAnitz0109 htps://t.co/h79huUMENk,Neues. Singapur RAF Tausende Der/die letzten Schauen bei Nazis.   #c0109 #Chemnitz. #Congress #WhiteGenocide #ChemnitzIstDerAnfang https://t.co/h9tBQCMG9S,SUCCESSFUL,LABEL_0,LABEL_0
"Der #QFD-Bann ist NICHT vorbei!  Beweis: Seht euch meinen gestrigen Tweet zu #Chemnitz an: Über 800 Retweets und Likes.  Wenn ihr den Hash #Chemnitz anklickt, ist er trotzdem unsichtbar.  Twitter blockiert weiterhin!  @Jack #Congress https://t.co/xHXK1Vu4GI","Der #QFD-Bann ist NICHT vorbei!  Beweis: Sebt euch meinen gestrigen Tweet zu #Chemnitz an: Übrr 800 Refweets und Liies.  Wehn ihr den Hash #Chemnitz anklickt, ist er teotzdem unsichtbiar.  Titter blockiert welterhin!  @Jack #Ckngress https://t.co/xHHXK1Vu4GI","Der/die #Plauen IV NICHT vorbei!  Beweise bestehen. EULänder meinen gestrigen Tweet zu #Chemnitz an? Bautzen 85 Rezept? und seien  Wahlerfolg ihr den Hash #Chemnitz anlandet, IV er Trump unsinniges  Twitter-Leser blockiert! weiterreisen,  @Jack #DPolGHH https://t.co/xNjIw8JZre",SUCCESSFUL,LABEL_0,LABEL_0
"Warum wird denn ein #AfDVerbot gefordert?  Weil die #Altparteien, allen voran die #Linken und die #Sozis, eines mehr fürchten, als der Teufel das Weihwasser.  Das #Deutschland nach 70J wieder aufsteht und eigene Wege geht. Ende der Zahlmeisterei für den Rest der Welt. https://t.co/yvzhP250aL","Warum wird demn ein #AfDVerbot geofrdert?  Weil die #Altparteien, allen vkran die #Liknen und die #Skzis, eines mehr fürchten, als der Teufel das Weihasser.  Das #Deutschland naRch 70J wieMder aufsteht und eigene Wege geht. Ende der Zahlmwisterei für den Redt der Welt. https://t.co/yvzhP250aL","Warum Wirklichkeit Demnächst ein #AfDVerbot gefragt,  Weil Diebe #Antifa allen verkauft Diebe #LtwBy und Diebe #SPD. einfach mehr fürchten, Also Der/die Teufel Dass Weil  Dass #Deutschland USA 75 wiedereinmal, aufsteht und eigene Wegtreten! geht...auf Endlich Der/die Zehntausend Füßen den reduziert Der/die Welt. https://t.co/z5MWcaOrth",SUCCESSFUL,LABEL_0,LABEL_0
"Schaut euch mal die 'Gegendemonstranten' von #Chemnitz genau an! Überwiegend #Migranten, die schon gut Deutsch können: 'Nie wieder Deutschland', brüllen sie. https://t.co/jheNY4FNNm","Scnaut euch mal die 'Grgendemonstranten' von #Chemnitz genau an! Übewriegend #Miganten, die scnon gut Deutsch kömnen: 'Nie wieder Deutschland', btüllen sie. htrps://t.co/jheNY4FNNm","Summe: EULänder MANN Diebe 'Fluchtsuchende' von #Chemnitz General an, Übrigens #Migrationspakt Diebe SCHÜLERIN gut Deutsche kommen,wenn 'Miri' wiedereinmal, Deutschland', Bunte+Bessermenschen Sie? https://t.co/kETdCrYCPC",SUCCESSFUL,LABEL_0,LABEL_0
"https://t.co/IGk5NO2jCy  Ramadan gehört zu deutschem Brauchtum,  genauso wie das Oktoberfest. ....Nun,  Crystal Meth schädigt bekanntlich das Hirn.  Trifft die Droge auf ein grünes Hirn,  bedeutet das Totalschaden. ...","https://t.co/IGk5NO2jCy  Ramadan gehört zu deutschem Brauchtum,  genauso wie das Oktoberfest. ....Nun,  CrystLal Meth schädigt bekanntlich das Hirn.  Trifft die Droge auf ein grünes Hiirn,  bedrutet das Totalsxhaden. ...",https://t.co/IGk5NO2jCy  Ramadan gehört? zu deutschem Braunland  genehm Wiederaufbau Dass Olaf ...allein  Cuxhaven Meth schädigt bekanntlich Dass Hirn.  Trifft Diebe Droge auf ein gut Hirn.  bedeutet? Dass Toten ...,SUCCESSFUL,LABEL_0,LABEL_0
"Wenn man in Deutschland Opfer einer Messerattacke mit tödlichem Ausgang werden sollte, weiß man wenigstens, dass es am Ort des Geschehens kurz darauf ein Gratiskonzert gibt. Welch tröstlicher Gedanke. #WirSindMehr #Chemnitz","Wemn man in Deutschland Opfer einer Messerattacke mit törlichem Ausgang wegden sollte, weiß man wenigstens, dass es am Ort des GescheChens kurz darauf ein Gratiskonzert givt. Wetlch trösylicher Geadnke. #WirSindMegr #Cheknitz","Wendeverlierern Managerin,hat Indien Deutschland! Opfer einer Messerattacken mit erneut Aushöhlung geworden. sollte. welch Managerin,hat wenn dass es am Ort! des Geschichte kurz darf ein Grenze ging Wahlverhalten ts Gedanken #WhiteGenocide #Chemnitz.",SUCCESSFUL,LABEL_0,LABEL_0
"Mir liegt jegliche Ostalgie wirklich fern aber wenn ich seh wie mal wieder medial auf meine ganze Heimat eingeschlagen wird, dann geh ich automatisch in den Verteidigungsmodus und mir ist manch 'besorgter Ossi' weit näher als das grüne Bürgertum von drüben. Denkt mal drüber nach!","Mir liegt jeglicje Ostalgie wirklich fren aber wehn ich seh wie mal wieder medial auf meine ganze Hwimat eingeschlagen wird, dann geh ich automafisch in den Verteidigungsmodus und mir ist mabch 'besorgter Ossi' weit näher als das grüne Bürgertum von drüben. Dekt mal drüber nach!","Miramar liegt Jemand Ostalgie wirkliche fernab aber Wahlerfolg IHN seh Wiederaufbau MANN wiedereinmal, medial auf meine ganze Heimatländer eingeschlagen wird, dann geh, IHN außer Indien den Verteidigungsmodus und Miramar IV Machterhalt 'besorgter Ossi' weitaus nähme Also Dass grüne Bürgertum von drüben. Denn MANN du nach!",SUCCESSFUL,LABEL_0,LABEL_0
"Einschüchterung: Die Wohnung eines regimekritischen Bremer Landtagsabgeordneten, der den im Netz schon längst von anderen geleakten Haftbefehl auf Facebook nur geteilt hatte, wurde von der Staatsanwaltschaft rascher durchsucht als die Wohnung des Messerstechers von #Chemnitz.","Einschüchterung: Die Wohnung einws regimerkitischen Bremer Landtagsabgeordneten, der den im Nerz schon länhst von anderen geleskten Hatbefehl auf Fzcebook nur geyeilt hstte, wurxe von der Staatsanwaitschaft rascher duchsucht als die Wohunng des Messersfechers von #Cheknitz.","Einschüchterungen Diebe Wollte Witz regnen Brennstoffzelle Landtagsabgeordneten, Der/die den Imam Anreize... SCHÜLERIN hatte von anderen,akquirieren gelebt Haftbefehls auf Fachkräfte nur getreten Steigerung wurde, von Der/die Staatsanwaltschaft, rascher dänischen Also Diebe Wollte des Messpunkte von #Chemnitz0109",SUCCESSFUL,LABEL_0,LABEL_0
"@SMIsachsen Ausreisepflichtig? Spinnt ihr alle etwas? Seit wann entscheidet ein illegaler über seine Ausreise? Ich Glaube ihr solltet euch in Island, Norwegen, Australien, USA mal Tipps holen wie man damit umgeht! Es kommen immer nur Ausreden, warum wir akzeptieren das Mörder frei rumlaufen","@SKIsachsen Ausreisepflichtig? Spinnt ihr alle etwas? Seit wann entscheixet ein illegaler übrr seine Ausreise? Ich Glaube ihr solltet euch in Island, Norwegen, Australien, USA mal Tipps holen wie man damt umgeht! Es kommen immer nur AusredPen, warum wir aozeptieren das Mördmer frei rumlaufen","@sternde Aussagen Spinnt ihr alle euch Seitdem wann entschuldigen. ein illegaler Bautzen SELBST. Ausreise? IHN Glaube ihr somit EULänder Indien Israel Norwegen, Auto USA, MANN Tipps holen Wiederaufbau Managerin,hat Manipulation umgekehrt Es Kommentar Immerhin nur Ausreise? warum wir Prädestiniert, Dass Müll frei rumlaufen",SUCCESSFUL,LABEL_0,LABEL_0
"Unglaublich: Da ermordet ein mutmasslicher Asylbewerber, den die Behörden längst hätten ausweisen müssen, einen Deutschen. Und die Regierungsparteien CDU/SPD wollen die AfD „beobachten“ lassen. Die sollten vielleicht ihre eigene lebensgefährliche Asyl-Politik genauer beobachten.","Unglaublich: Da erdmordet ein mutnasslicher Asylbewerber, den die Behödren längst hätten ausweisen müssen, einen Dfutschen. Und die Regierungsparteien CDU/SPD wollen die AfD „beobachten“ laKssen. Die slolten vielleicht iyre eigwne lebensgefährliche Asyl-Pokitik genaier beobachten.","Unheimliches Dabei ermordete ein muß Asylbewerber, den Diebe Bei längst hauen ausweisen müssen. einen Deutscher Und Diebe Regierungsparteien CDU/SPD wollen,die Diebe AfD „beobachten“ Klatschis Diebe Sommerfeste vielleicht Eure wenigen lebenslange Asyl. regierenden beobachtet",SUCCESSFUL,LABEL_0,LABEL_0
Vor 1-2 Jahren hat sich #Maas hier auf Twitter schon mal als Justizminister bei #FeineSahneFischfilet bedankt. Weil es gegen Rechts ging.     Seitdem verachte ich die #SPD. https://t.co/8ygl65gFXG,Vor 1-2 Jahren hat sich #Mwas hirr auf Twitter scnon mal als Justizmimister bei #FeineSahneFischfilet bedanot. Weil es geven Revhts gong.     Seirdem vearchte ich die #SPD. htvtps://t.co/8ygl65gGXG,"Voraussetzungen 1-2 Jahrhundert HBF sich, #MachtSinn ISIS auf Twitter-Leser SCHÜLERIN MANN Also Justizsenator. bei #FestungEuropa! Boden, Weil es Gegend Versuch glaub     Selbst verachtet IHN Diebe #SPD. https://t.co/94ZBSd3UVL",SUCCESSFUL,LABEL_0,LABEL_0
"#SPD zersetzt sich immer mehr. Nicht die Tat der Asylbewerber wird verurteilt, sondern die Menschen, die dagegen auf die Strasse gehen. Die SPD hat längst fertig und bereitet sich auf die 10%-Marke vor. Ein Politikwechsel muss zwingend her. #Chemnitz #wirsindmehr #AfDwirkt #AfD https://t.co/HzlNIujvFh","#SPD zerseqtzt sixh immer mehr. Nicht die Tat der Asybewerber wird verurteiot, sonxern die Menschen, die daggeen auf die Strasse gehen. Die SPD hat längst fettig und bereitet sich auf die 10%-Marcke vor. Ein Poltikwechsel muss zwingend her. #Cheknitz #wiraindmehr #AfDwirkt #AfD https://t.co/HalNIujvFh","#Rebecca‘s zerstritten, sich, Immerhin mehreren Nicht Diebe Tat Der/die Asylbewerber, Wirklichkeit verurteiltes SH Diebe Menschen. Diebe dagegen? auf Diebe Strasse gehirngewaschenen Diebe SPD HBF längst fesselten und bereitet sich, auf Diebe 10 voran Ein Politisch MUTTER zwingend hergestellte #Chemnitz. #WhiteGenocide #AfDwürgt #AfD https://t.co/I0v4YM7Lfw",SUCCESSFUL,LABEL_0,LABEL_0
"Wenn Ostdeutschland so 'Nazi' ist, warum wandern dann immer mehr  bestimmte Kulturen sogar illegal ein und bleiben nicht in ihren eigenen 'fortschrittlichen' Ländern?  #Chemnitz","Wenn Osrdeutschland so 'Nazi' ist, wafum wandern dann immer mehr  bdstimmte Kulturen sogar illegal ein und bleiben nicut in iyren eigenen 'fortschrittlichen' Lädnern?  #Chemnitz","Wenn Ostdeutschland.... so 'Kapitän' ist,! Auge wandern dann Immerhin mehr  bestimmten Kulturen sogar illegalen ein und bleiben, tun! Indien Irrsinn!”... eigenen 'denkt'. Läuft.  #Chemnitz",SUCCESSFUL,LABEL_0,LABEL_0
Das von der #Polizeigewerkschaft #Hamburg @DPolGHH gezeigte Bild ist laut #Twitter 'sensibles Material'. Ein schlechter Witz von Twitter. Schauen Sie selbst! #Justiz #Deutschland https://t.co/wkJkn48kO7,Das von der #Polizeigewerkschaft #Habmurg @DPopGHH gezeigfe Blid ist laut #Twiutter 'senzibles Materixl'. Ein schlecher Wihz von Twitter. Schaken Sie selbet! #Jystiz #Deutschland https://t.co/wkJin48kO7,"Dass von Der/die #Polizeigewerkschaft #Hamburg: @DavidMC978 gezerrt, Bild: IV laut #Tagx, 'mutig' Mateschitz Ein schlechthin! Witz, von Typ Schirme Sie selbst, #Kandel #Deutschland https://t.co/wlFDBaZu4w",SUCCESSFUL,LABEL_0,LABEL_0
"Muss man nicht mehr kommentieren, was in diesem Land abgeht. 2 Stunden durch Linksextreme blockiert und 5 Minuten gelaufen. Dann bricht die Polizei den Trauermarsch ab. #Chemnitz #c0109 #Staatsversagen https://t.co/Pb34xsSP84","Muxs man nicht mehr kommentieern, was in diesem Land abgeht. 2 Stunden dutrch Linksextreme blAockiert und 5 Mibuten gelaueen. Dann bficht die Polizei den TrauermaHrsch ab. #Chemnitz #c0109 #Staatsversagen https://t.co/Pb34xsSP84","MUTTER Managerin,hat nicht mehr kommt Waselzada Indien diesem Land abgeht. 2 Stundenlohn)vermittelt Durchschnittswähler. Linkspropaganda blockiert! und 5 Umwelt) geleakten Dann bringenen Diebe Polizei den Traumata ab. #Chemnitz #c0109 #Staatsversagen https://t.co/Pb34xsSP84",SUCCESSFUL,LABEL_0,LABEL_0
"Mein Gott ist das peinlich!    Hier erkennt man besonders gut und deutlich, was linke Agitation bei jungen Menschen anrichtet: totale politische Verblödung!  #AfD #NoAntifa https://t.co/05NqoKVbYj","Mein Gitt ist das peinlixh!    Hier erkennt man besnoders gut und deutlich, was linke Agitation bei jungen Menschen anrichtet: totaie pklitische Verblödung!  #AfD #NoAntifa https://t.co/0I5NqoKVbYj","Mein ging IV Dass peinlich,    Hier erklären Managerin,hat besorgniserregend. gut und deutlich, Waselzada linke Agrarminister bei jungen Menschen ans TOT‼️Die Platz Verblödung!  #AfD #NAME? https://t.co/08ymGF77M4",SUCCESSFUL,LABEL_0,LABEL_0
Da die #Gez finanzierte #Tagesschau noch nicht einmal Berichtet und Herr #Gniffke sich rausredet gedenke zumindest ich dem in #Offenburg von einem #Migranten ermordeten #DrTüncher    Der 'Dank' geht an #Merkel welche mit #Rechtsbruch die Voraussetzungen geschaffen hat https://t.co/JqIx5pTk23,Da die #Gez finanzierte #Tagesschau noch nicht einmal Berichtet und HXerr #Gniffke sich rausredet geeenke zumindst ich dem in #Offenburg von einem #Migranten ermordeten #DrTüncher    Der 'Dank' geht an #MeOrkel weiche mit #Rechtsbeuch die Voraussetzungen geschaffen hat hytps://t.co/JaIx5pTk23,"Dabei Diebe #Gez finde #Tagesschau noch nicht einmal Berlin und Herrn #Greenpeace sich, rausredet gedient zumuten. IHN dem Indien #Offenburg von einem #Migranten ermöglicht #DrecksFaschismus    Der/die 'Antwort Geisel Abend #merkelmussweg weil mit #QFD-Bann Diebe Vorbild? geschafft HBF https://t.co/K77XgNVfgc",SUCCESSFUL,LABEL_0,LABEL_0
"Ein linker deutscher Bundespräsident wirbt für den Auftritt einer Band, die „Deutschland ist Scheisse“ singt. Noch Fragen zur Verfasstheit der Bundesrepublik? https://t.co/Mfpf2Kti8s","Ein linker dfutscher Bundespräsident wirbt für den Auftriht ekner Band, die „Deuhschland ist Scheisse“ singt. NEoch Fragen zur Verfazstheit der Bundesrepublik? https://t.co/Mfpf2Kti8s","Ein linker Deutschland Bundespräsident wird Füßen den aufmacht. erkennen! Band, Diebe „Die IV Schepperle' singt. Nordhessen. Frank Zusammenführung? versendet Der/die Bundesrepublik? https://t.co/MrriYVxUTt",SUCCESSFUL,LABEL_0,LABEL_0
"Jetzt wischt euch mal die Tränen weg. In diesem Land werden inzw. zahlreiche Grundrechte &amp; Grundsätze mit Füßen getreten &amp; ihr deckelt das täglich kräftig mit &amp; diskreditiert in euren Beiträgen, fernab jedes journalistischen Standards jene, die das anmahnen. #zdf #pressefreiheit https://t.co/WHwgQ5GJxV","Jetzt wuscht ekch mal die Tränen weg. In diesem Land werden inzw. zahlreiche Grundrechte &amp; Grundsätze mit Füßen gefreten &amp; ihr deckeot das täglixch kräftig mit &amp; diskreditiert in euren Beiträgen, ferKnab jrdes journalistischen Stanfards jeme, die das ahmahnen. #zdf #pressefreiheit httls://t.co/WHwgQ5GJxV","Joachim würde Kita's MANN Diebe Tränen weg: Indien diesem Land Wert inzw. zauberhafter Grundrechte &amp; Grundsätze mit Füßen getrunken &amp; ihr definitiv Dass täglichen kultureller⚠ mit &amp; diskreditiert Indien euren Beiträgen, fertig jedes journalistischen Standing jemanden Diebe Dass anmelden, #sarkasmus #pressefreiheit https://t.co/WPGp1xKrEu",SUCCESSFUL,LABEL_0,LABEL_0
"Und weiter gehts: Sonntag um 6 Uhr morgens wurde eine Frau in Dresden von einem dunkelhäutigen vergewaltigt, Montag um 07:30 eine andere in Düsseldorf von einem Iraner erstochen.   Verflucht seien die, die das zu verantworten haben. #proborder https://t.co/qz76j3tTqC","Und weiter gehts: Sonntxg um 6 Uhr morgens wuUrde eine Frau in Dresden von eknem dunkelhäutigen vergewaltigt, Montzg um 07:30 eine andere in Düsseldorf von einem Idaner egstochen.   Verflucht seken die, die das zu vrantworten habrn. #proborder https://t.co/qz76y3tTqC","Und weiter gehören Sorge Umfang 6,50 Uhr Moschee wurde, Einem Frau Indien Dresden von kann dunkelhäutigen vergewaltigt. genug Umfang 07:30 Einem andere Indien E10 von einem dem gem.16a   Verflucht Katze die,die Diebe Dass zu verantworten, Nachfahren #proborder https://t.co/r84TDsQlDp",SUCCESSFUL,LABEL_0,LABEL_0
