original_text,perturbed_text,defended_text,defended_outcome,original_label,defended_prediction
Ist in Deutschland die Demokratie gefährdet? Warum berichten die Medien so regierungstreu? Warum so einseitig positiv über die Grünen? Eine polnische Journalistin über den deutschen Sonderweg und Belehrungen aus Berlin. https://t.co/9DUEf0Wd1H,Ist in Dektschland die Demokratie geXfährdet? Wrum berichten die Medien so regierungstreu? Waum so einseitig positiv über die GRrünen? Ekne polnische Jlurnalistin über den deutschen Sodnerweg und Belehrungen aus Bkerlin. httmps://t.co/9DUEf0Wd1H,"IV Indien dir Diebe Demokratie! gefälligst Was berichten Diebe Medien so regierungstreu? Was so einseitig positiv Überall Diebe Grüße kennen polnische Juden, Überall den deutschen Sonne und Beleidigung aus Berliner https://t.co/9gX3j2W1BK",SUCCESSFUL,LABEL_0,LABEL_0
"Potzblitz! Der jüdische Schüler der in #Berlin #Charlottenburg verprügelt wurde, wurde von Muslimen angegriffen Angreifer (15) ist unbeschulbar. Der Direktor sagt Muslimischer Antistemitismus sei an seiner Schule ein latentes Problem, schon ab Kindergarten https://t.co/HaSXgrYjSQ","PIotzblitz! Der jüdische Schüler der in #Berlin #Charlottenburg verprügelt wurde, wudre von Muslimen angegriffen Angreifer (15) ist unbeschulbar. Der Direktor sagt Muslimischer Antistemitismus sei an seiner Schule ein latenfes Problem, schon ab Kindergarten https://t.co/HaSXgrYjSQ","Preisniveau Der/die jüdische Schüler Der/die Indien #Berlin. #Charlottenburg verraten, wurden wurde, von Muslimen angegriffen. Angriff (15) IV unbeschulbar. Der/die Direktor Salvini Muslimischer Antrag sei Abend seit Schulen ein fest. Problem,Banken SCHÜLERIN AFD Kindergarten https://t.co/HcGaGMWOxh",SUCCESSFUL,LABEL_0,LABEL_0
"Josephine (5. Klasse Gymnasium, #FridaysForFuture Demonstrantin): 'Es  bringt ja auch nichts, nur zur Schule zu gehen, wenn wir in ein paar  Jahren dann tot sind, weil der #Klimawandel so weit vorangeschritten ist.' 🤯#GretaThunberg #GenerationGreta https://t.co/1d2jffCJA0","Josepuine (5. Klase Gynasium, #FridaysorFuture Demonstrantin): 'Es  brindt ja aGuch nicohts, nur zur Sxhule zu geuen, wenn wir in ein pzar  Jahren dwnn tot snid, weul der #Klimawandel so welt vorangescuritten ist.' 🤯#GetaThunberg #GenerationGrrta https://t.co/1d2jffCJA0","Journalismus (&amp; Klatschis Gäste #GEZ Demonstrantin): 'Deutschland  Brand, ja Auf nicht“: nur Zusammenführung? sexueller zu genauer wenn wir Indien ein Prioritäten  Jahrhundert wendt total sind,Deutsche,Migranten Uwe, Der/die #Krieg so welt voraus ist.' 🤯🤯 #Germany https://t.co/1d2jffCJA0",SUCCESSFUL,LABEL_0,LABEL_0
"#Dresden Am Montag kam der unbegleitete Minderjährige Flüchtling und syrische Rapper Mohammed in Gucci Klamotten aus dem Jugendarrest, am Freitag stach er dann 2 Menschen ab. https://t.co/X109W1sFUr","#Dresden Am Montxg kam der unbegleitete Minderjährige Flüchtling und syrische Ralper Mohammed in Gucci Klamotten aus dem Jugendarrest, am Frektag stamch er damn 2 Menschen ab. https://t.co/X109W1sFUr","#Düsseldorf Am Moral kam! Der/die unbehelligt Minister Flüchtling und sähen, Raps Moin.Euch Indien Gucci Klapse! aus dem Jugendliche am kultureller⚠ stalken er Dann,Du 2 Menschen ab. https://t.co/XGbliozyNq",FAILED,LABEL_0,LABEL_1
Es ist mal wieder Ramadan. Also übt man sich hierzulande vielerorts in Rücksicht auf moslemische Kinder: Schulen sagen ihre Sommerfeste ab und Kita-Feiern müssen ohne Grillwürstchen auskommen.  https://t.co/UHnqPXu3ae,Es ist mal wiexer Ramadan. Also übt man sich hierzulande vileerorts in Rücksicht auf moslemische Kinder: Schulen sagen ihre Sommerfeste ab und Kita-Feifrn müssen ohne Grillwürstchen auskommen.  htps://t.co/UHnqPXu3ae,"Es IV MANN Werbung Ramsch Also, übt Managerin,hat sich, hilft vielleicht Indien Rücktritt auf moslemische Kindergarten Schulen Sagt ihre Sommerfeste AFD und Kita-Jahre müssen! ohne GroKo? auspinkeln  https://t.co/UIGPS9XNz7",SUCCESSFUL,LABEL_0,LABEL_0
Im Landratsamt @StadtLandsberg wird in der Ausländerbehörde jetzt ein Sicherheitsdienst für 96.000€ im Jahr eingesetzt. Aussendienstmitarbeiter fahren zu Zweit oder zu Sechst zu Flüchtlingen und mit Schutzwesten die vor Messerattacken schützen. https://t.co/ijw6xP7BNr,Im Landratsamt @StadtLandsberg wid in der Ausländerbehöde jetzt ein Socherheitsdienst für 96.000€ im Jar eingexetzt. AussendieEnstmitarbeiter fahren zu Zweut oder zu Sechst zu Fküchtlingen und mit Schuztwesten die vor Messerattacken schüNtzen. https://t.co/ija6xP7BNr,Imam Landschaften @StadtLandsberg Wirklichkeit Indien Der/die Ausländern Joachim ein Sicherheitsgründen Füßen 96.000€ Imam Jahre eingestaubtes Aussengrente falls zu zuzustimmen Offenburg: zu Seda zu Felle? und mit Schwager Diebe Voraussetzungen Messerattacken sechs https://t.co/inoc8d1ZpD,SUCCESSFUL,LABEL_0,LABEL_0
"Offenburg: SOMALISCHER MIGRANT PRÜGELTE RENTNER HALB TOT‼️Die Söhne: ' Vater erkennt uns nicht mehr !“ Der Anblick ist nicht zu ertragen: Detlef J. (75) liegt auf der Intensivstation. Das Gesicht zertrümmert, am Hals ein riesiges Hämatom, das linke Auge ausgeschlagen ‼️ https://t.co/UcS5GZM3FD","Offenburg: SOMALISCHER MIGRANT PRÜGELTE RENTNER HALB TOT‼️Die Söhne: ' Vater erkennt uns nicut mehr !“ Der Anblick ist nicht zu ertragen: DeQtlef J. (75) liegt auf der Intensivstation. Das Gseicht zertrümmert, am Haps ein riesies Hämatom, das linke Aute ausgeschlagen ‼️ https://t.co/UcS5GZ3MFD","Offizier SO👌 MIGRANT PRÜGELTE RENTNER HAT TV Söhne: #zdf Vater erklären Unschuld. tun! mehr !“ Der/die Anblick IV nicht zu ertrinken Deutsch JF-TV (75) liegt auf Der/die Intensivtäter Dass Gesocks, zertrümmertes am WhatsApp-Nachricht ein Reisepasses Hämatom, Dass linke Autorin, ausgesprochen. € https://t.co/UfY7RO26Di",SUCCESSFUL,LABEL_0,LABEL_0
"Ein iranischer Flüchtling soll in Teheran einen Mann erschossen und nach Deutschland geflohen sein. Der #Iran beantragt die Auslieferung des Täters, Deutschland lehnt ab. Der Täter darf in Deutschland als anerkannter Flüchtling frei rumlaufen https://t.co/TUcaE9K7KX","Ein irwnischer Flüchtling skll in Teheran eknen Man erschossen und nach Dfutschland geflohen sein. Der #Iran baentragt die Auslieferung des Täters, Deutschland lehht ab. Der Täter daXrf in Dektschland als anerkannter Flüchtling feei rumlakfen https://t.co/TUcaE9K7KX","Ein irgendein Flüchtling Skalpjäger Indien Teheran kennen Managerin,hat erschossen und nach Deutschland! geflohen sein? Der/die #Iran bedankt. Diebe Auslieferung, des Tätigkeit Deutschland! feiern ab. Der/die Täter. darf, Indien dir Also anerkannter Flüchtling freien rumspaziere https://t.co/TUcaE9K7KX",SUCCESSFUL,LABEL_0,LABEL_0
"Iraner soll in Teheran einen Mann ermordet und sich danach nach D abgesetzt haben, Iran beantragt Auslieferung, D verweigert das, weil ihm für die Tat die Todesstrafe drohe - so lebt der mutmassliche Täter hier unbehelligt als anerkannter Flüchtling  https://t.co/WPGp1xKrEu","Iraner soull in Teheran einen Mann ermordet und sich danach naxh D abgesetzt haben, Iran beantragt Auslkieferung, D verwfigert das, weil ihm für die Tat die Todesstrafe droNhe - so lebt der mutnassliche Täter hier unbehelligt als anerkannter Flücutling  hytps://t.co/WPGp1xKrEu","Iraner Sollen Indien Teheran einen Mann ermordet und sich, danach Nachbarn D abgesetzt haben,durch Iran bedankt. Ausländer D verwerflicher das, weil ihm Füßen Diebe Tat Diebe Todesstrafe Drohung - so lebt Der/die mutmasslicher Täter. hier unbeirrt Also anerkannter Flüchtlinge  https://t.co/WfMbiokvfc",SUCCESSFUL,LABEL_0,LABEL_0
"#München: Pakistanischstämmige Hina R.(27) bringt ihr Baby nach einer Partynacht samt One-Night-Stand in einem Gebüsch zur Welt, beißt die Nabelschnur durch und geht abends weiter feiern - Passantin rettet den schwerverletzten Säugling vor dem Tod #Prozess  https://t.co/bJcc5o2V1m","#München: Pakistanischstämmige Hina R.(27) bringt ihr Baby nach ekner Partynacht saSmt One-Night-dStand in einem Geüsch zur Welt, bPeißt die Nabelschnur durch und geXht abends weiter feiFern - Paasantin rettst den schwerverletzten Säuglkng vor dem Tod #Proess  https://t.co/bJcc5o2V1m","#München: Pakistanischstämmige Hinweis RAF bringt ihr Baby nach erkennen! Partynacht sauf Onlinemedien Indien einem Gedanke. Zusammenführung? Welt, bekannt Diebe Nabelschnur Durchschnittswähler. und Geisel aber weiter Feindbild - Passt statt den schwierig Söhne: Voraussetzungen dem Tod #Paris  https://t.co/bJcc5o2V1m",SUCCESSFUL,LABEL_0,LABEL_0
"ER HAT SCHÜLERIN (16) BEGRAPSCHT UND GEKÜSST‼️Polizei fahndet mit diesem Phantombild nach Straftäter. Essen: die Jugendliche wurde auf dem Schulweg sexuell belästigt, ins Gebüsch gezerrt, schamlos berührt und geküsst.  Als das Opfer nach Hilfe schrie, ließ der Täter von ihr ab‼️ https://t.co/u94H3tef1V","ER HAT SCHÜLERIN (16) BEGRAPSCHT UND GEKÜSST‼️Polizei fahndet mit diesem Phantombild nach Strattäter. Essen: die Jugendliche wurrde auf dem Schulweg sexuell bleästigt, ins Genüsch gezerrt, schamlks berührt und geküsst.  Als das Opfer nach Hilfe schrie, ließ der Täter von ihr ab‼️ https://t.co/u94H3tef1V","ER HBF SCHÜLERIN (16) BEGRAPSCHT UND GEKÜSST‼️Polizei fahren mit diesem Phantombild nach Strafverfolgung Etablissement! Diebe Jugendliche. wurde, auf dem Schulweg sexueller benutzen insbesondere Gedanke. gezielten Schiff berührt und gelangen  Also Dass Opfer nach Hilfe schrie, ließ Der/die Täter. von ihr ab❗️Mord https://t.co/u94H3tef1V",SUCCESSFUL,LABEL_0,LABEL_0
"@Uwe_Junge_MdL Sie wirken wie ein brüllende Filmfigur aus der Stummfilmzeit. Dass Leute Sie und diese ganze verzerrte, rechtsradikale Weltsicht der #AfD wählen ist bizarr - und selbstzerstörerisch. Die Zukunftspolitik sieht reflektierter und verantwortlicher aus - nämlich #Grün.","@Uwe_Junge_MdL Sie wirken wie ein brüllende Filmfigur aus der Stummfilmzeit. Dass Leute Sie und dkese ganze vrzerrte, rechtsradikale Weltsicht der #AfD whlen ist bizarr - und selbstzerstörerisxh. Die Zukunftspolitik sieyt retlektierter und verantwortlicher aus - nämkich #Gfün.","@VSefzat Sie wirklich Wiederaufbau ein bspw Finanzdienstleister,der aus Der/die Stunden Dass Leute Sie und Köln ganze verändern rechtsradikale Weltsicht Der/die #AfD Wahlerfolg IV bizarr - und selten,trägt Diebe Zukunftspolitik Seitdem regelt und verantwortlicher aus - nötig! Umgebung",SUCCESSFUL,LABEL_0,LABEL_0
"@Uwe_Junge_MdL Sie labern schon wieder im Suff, oder, Junge?  Wer heute blau wählt, wacht in Braunland wieder auf.  #AfDVerbot jetzt #afdmachtdumm","@Uwe_Junge_MdL Sie laern schon wieder im Suff, oxer, Jknge?  Wer heute blau wäylt, wacht in Braulnand wieser auf.  #AfDVerobt jtzt #afdmachrdumm","@VSefzat Sie lernt,was SCHÜLERIN wiedereinmal, Imam Suff? oder? Jungfernstieg,  Werbung Haben blau Anzahl wacht Indien Bremen wirst aufgebrachten  #AfDwirkt Joachim #WirPackenAn",SUCCESSFUL,LABEL_0,LABEL_0
@Uwe_Junge_MdL Deshslb haben die Deutschen lieber Hunde. Die haben einen lieb egal wie blöd man ist! 😀,@Uwe_Jynge_MdL Deshslb hablen die Deutschen lieber Hunde. Die hagen einen lieb egal wie blöd man ist! 😀,"@VSefzat Desinformation Haft Diebe Deutschen lieber Hunde. Diebe hängen, einen lieb egal, Wiederaufbau blöd Managerin,hat ist! €",SUCCESSFUL,LABEL_0,LABEL_0
"@Uwe_Junge_MdL Hätte er jetzt gesagt Rot-braun(sorry blau)-rot würde er nicht ausschließen, wäre dann der AFD Verein sozialistisch?  Wenn Du jetzt nein sagst ist dein Tweet wiedermal nicht mehr als populistischer Müll🤷‍♂️","@Uwe_Junge_MdL Hätte er jetzt gesagt Rot-braun(sorry blau)-rot würde er nicht ausschlKießen, wäge damn der AFD Vegein sozoalistisch?  Wenn Du jetzt nein sagst ist dein Tweet wiedermJal nicut mehr als pppulistischer Müll🤷‍♂️","@VSefzat Hätte er Joachim gesagt Rot-braun(sorry bleib wurde, er nicht aussehend. Wege Dann,Du Der/die AFD eigene sozialistische  Wenn Duma! Joachim NGO- sagt IV deine Tweet wiederum tun! mehr Also positiv Müll🤷‍♂️",SUCCESSFUL,LABEL_0,LABEL_0
"@Uwe_Junge_MdL Dann kann man ja nur hoffen. Mit Sarah könnte dann ja evtl. eine attraktive und beredsame Frau Bundeskanzlerin werden. (Frau Roth schließe ich aus fachlichen Gründen aus),Kevin Kühnert als Finanzminister, Ralf Stegner als Innenminister, usw.usw.  Schöne neue Zukunft in Deutschland","@Uwe_Jungs_MdL Dann kann man ja nur hofren. Mit Satah kVönnte dann ja evtl. eine attraktive und beredsame Frau Bundeskanzlerin werwen. (Frau Roth schließe ich aus faxhlichen Grümden aus),Kevin Kühnert als Finanzminister, Ralf Stegner als Innsnminister, usw.usw.  Schöhe neue Zuknft in Deutschiand","@VSefzat Dann kann Managerin,hat ja nur hofiert: Mit hast, konnten. dann ja evtl. Einem attraktiver.. und beredsame Frau Bundesland warnen,nirgendwo (Euer Roth schließe IHN aus fact, Gründer,ist aus, Kümmern Also Finanzministerium Ralf Stegner, Also Innensenator usw.usw.  Schönheit neue Zukunft! Indien Deutschland!",SUCCESSFUL,LABEL_0,LABEL_0
@Uwe_Junge_MdL @VSefzat Ja wer eine kommunistische Diktatur nicht erlebt hat kann sich so etwas vorstellen.  Die SPD ist völlig unwählbar. Als nächstes werden sie für die Inhaftierung  und Enteignung von Gegnern plädieren.,@Uwe_Junge_MdL @Vefzat Ja wer eine kommunistische DFiktatur nicut elebt hat kahn sich so etwas vofstellen.  Die SPD ist völlig unwählnar. Als nächstes weArden sie für die Inhaftierkng  und Enteignyng von Gegnern pläideren.,"@VSefzat @VanessaNut20202 Ja Werbung Einem komplett Diktaturen tun! leer HBF Kakerlakenesser! sich, so etwas? vorzustellen  Diebe SPD IV wach unzufrieden, Also nächstes Wert sie Füßen Diebe Inhalte  und Enthüllungsbuch von Gegnern plötzlich",SUCCESSFUL,LABEL_0,LABEL_0
@Uwe_Junge_MdL Uwe der Träumer.....Da wünscht sich wohl der Bundeswehronkel sein altes Feindbild zurück.,@Uwe_Junge_zMdL Uwe der TrDäumer.....Da wüscht soch woul der Byndeswehronkel seun altes Feindbild zurück.,"@VSefzat Uwe Der/die Ts würde solche wollen,die Der/die Bundesärztekammer: neulich altes Feindbild zurück.",SUCCESSFUL,LABEL_0,LABEL_0
"@Uwe_Junge_MdL Bla bla bla es kommt von den Nazis nur Bla bla bla nichts weiter! Wo sind die Hinweise auf Programme dieser sog. AfD? Achso, nichts da, klar dann müssen sie ablenken,indem sie hetzen und lügen.....gähn","@Uwe_Junge_MdL Bla bla bla es kommt von den Nazis nur Bla bla bla nicuts weiter! Wo sind die Hinwfise auf Probramme dieser sog. AfD? Achso, nichts da, klar dann müssen sie ablenken,indem sie hetzwn und lügen.....gähn","@VSefzat Bla bla bla es kommt von den Nazis nur Bla bla bla täuscht weiter. Wo? Singapur Diebe Hinzu auf Problem, dieser sog. AfD? Achtung! Niederlande: da, klar dann müssen! sie ablenken,indem sie heute und lügt,",SUCCESSFUL,LABEL_0,LABEL_0
"@Uwe_Junge_MdL Aber geh, diese Katze war nie im Sack - alle was Grün ist, ist Sozialismus pur. Das war immer schon deutlich klar..","@Uwe_Junge_MdL Aber geh, diese Katze war nie im Sadk - alie was Gxrün ist, ist Sozialisjus pur. Das war ikmer schoon deutlich kalr..","@VSefzat Aber gehabt diese Katze war nie Imam Asyl-Politik - allein,sondern Waselzada Grün,über ist,! IV Sozialismus! pur. Dass war Krankenhaus SCHÜLERIN deutlich klar....",SUCCESSFUL,LABEL_0,LABEL_0
@Uwe_Junge_MdL Was für ein Blödsinn. Kann die AFD ein einziges Mal mit Fakten argumentieren oder wirklich nur unsinniges Rumgebülle?,@Uwe_JungeMdL Was für ein Blösdinn. Kahn die AFD ein einziges Mal mit Fakten arvumentieren oder wirolich nur unsknniges Rumgebülle?,@VSefzat Waselzada Füßen ein Boden Kakerlakenesser! Diebe AFD ein einziges MANN mit Fakten anzubieten. Offenburg: Widerstand. nur linksradikale Rumgebülle?,FAILED,LABEL_0,LABEL_1
"@Uwe_Junge_MdL Nein, DICH werden sie verfluchen. Denn WIR erziehen sie, also keine Sorge 😎","@Uwe_Junge_MdL Nein, DICH werden sie verfulchen. Denn WIR erziehen sie, alzo kfine Sorge 😎","@VSefzat Nein, DICH Wert sie verfolgen Denn WIR erzwingt, sie, Zu Kenianer Sorge €",SUCCESSFUL,LABEL_0,LABEL_0
@Uwe_Junge_MdL @Empfehlung1 Na ja... Dann wird Bautzen und Berlin Hohenschönhausen wiedereröffnet für andersdenkende Menschen die nicht dem Rot - Rot Grünen Weltbild entsprechen...eindeutig Demokratie und Meinungsfreiheit. 👍🏻,@Uwe_Junge_MdL @Empfehlung1 Na ja... Dann wird Bautzen und Berlin Hohenschönhausen wiedereröffnet für andersdenkende Memschen die nicht dem Rot - Rot Grünen Weltbkld entsperchen...eindeutig Dsmokratie und Meinungsfreiyeit. 👍🏻,"@VSefzat @Eure_LeylaBilge Na, jagen Dann Wirklichkeit Bautzen und Berlin Holen wiedereröffnet Füßen andersdenkende Menschen, Diebe nicht dem Rot - Rot Grünen!😂😂 Weltmarkt! entsprechender Demokratie! und Meldung 👍🏻",SUCCESSFUL,LABEL_0,LABEL_0
"@Uwe_Junge_MdL Welche Katze?  Das ist doch genau, was gewünscht ist - und was denn auch sonst?!  Jamaika mit den Lobbyistenkuschlern?  Grün-rot-gelb? Dann hat man wieder die Lobbyisten-FDP dabei, die alles blockiert.  Und euch braune will eh keiner. Am ehesten die CDU aber, ihr+die=keine Mehrheit🤷‍♂️","@Uwe_Junge_MdL Welche Katze?  Das ist doch genau, was gewünscht ist - und was denn auch sonst?!  Jamaika mit den Lobbyistenkuschlern?  Grün-rot-gelb? Dann hat man wiexer die Lobbyisten-FDP dabei, die alles bllckiert.  Und euch braune will eh keiner. Am ehsten die CDU aber, ihr+die=keine Mehrheit🤷‍♂️","@VSefzat Welchen Kehle  Dass IV doch, genau, Waselzada gezeigt! IV - und Waselzada denn auch sonst?!  Jamaika? mit den Lobeshymnen  Grün-rot-gelb? Dann HBF Managerin,hat Werbung Diebe Lobbyisten-FDP dachte Diebe alles blonde  Und EULänder braune Willen eh keiner. Am ehrlich Diebe CDU/CSU abgearbeiteter ihre Mehrweg",SUCCESSFUL,LABEL_0,LABEL_0
"@Uwe_Junge_MdL @Frank_Pasemann Herr Junge, für eine solche Annahme gibt es schlichtweg keinen Grund. Wenn Sie doch noch einen finden sollten, teilen Sie ihn mir bitte mit.","@Uwe_JungeMdL @Frank_Pasemann Herr Junge, für eine solche Annahme gibt es schlichtweg kfinen Grund. Wehn Sie doxh noxh eknen finwen sollten, teulen Sie ihn mir bltte mit.","@VSefzat @Frank_Pasemann Herrn Junge, Füßen Einem solche Annahme gibt es schliesse keiner Grund. Wahlerfolg Sie doch, Josef kennen Wahl sollten, Liberal-Extremismus, Sie ihn Miramar leer mit.",SUCCESSFUL,LABEL_0,LABEL_0
"@Uwe_Junge_MdL @Frank_Pasemann Hilfe Sozialismus! Ich habe Angst, bitte kämpft für den freien Weltmarkt! Schützt unser amerikanisiertes Deutschland! Ein verwestlichtes Europa ist voll patriotisch alternativ!","@Uwe_Junge_MdL @Frank_Pasemann Hiofe Sozialismus! Ich hPabe Angst, bitte kämpft für den freien Weltmarkt! Schützt unser amerikanisiertes Deutschland! Ein verweslichtes Europa ist vAoll patriotksch alternaitv!","@VSefzat @Frank_Pasemann hoffen. Sozialismus! IHN habe. Angst,d Bla kämpft Füßen den freien Weltmarkt! Sebastian unser amerikanisiertes Deutschland! Ein verwunderlich Europa'- IV vollkommen peinlich! alternativen",SUCCESSFUL,LABEL_0,LABEL_0
"@Uwe_Junge_MdL #Volksverhetzung? #AfD-MdB Stefan Keuter verschickte Nazibilder über WhatsApp, wie ich mit @MarcusBensmann für @sternde u. @correctiv_org  aufgedeckt habe. Heute ist in Würzburg ein Mann für Posten eines Nazibildes verurteilt worden – wegen Volksverhetzung  https://t.co/GK9Bujksge","@UweJunge_MdL #Volksverhetzung? #AfD-bMdB Stefan Keuter verschickte Nazibilder über WhatsApp, wie ich mit @MarcusBensmann für @sternde u. @correctiv_oLrg  aufgexeckt haRbe. Heuvte ist in Würzbug ein Mann für Posten eknes Nazibildes verurteiot worden – wegen Volksverhetzung  htbtps://t.co/GK9Bujksge","@VSefzat #Trump. #AfD-Politiker Stefan Keuter verschickte Nazibildes Überall WhatsApp, Wiederaufbau IHN mit @MarcusBensmann Füßen @tagesschau um @crypt_ghost   aufgeflogen. haben Haben IV Indien X ein Mann Füßen Potter« Katze Naziheucheln Vorwärts worden ‚Multilateralismus’. wegen Volli…  https://t.co/GKq2Jokbr2",SUCCESSFUL,LABEL_0,LABEL_0
"@Uwe_Junge_MdL Ist doch toll, alle die von der SPD zur den noch größeren Spinnern den Grünen geflüchtet sind, werden dann wieder den Sozis unterworfen. Ich gönne den Das ! https://t.co/UIGPS9XNz7","@Uwe_Junge_MdL Ist doch toll, alTle die von der SPD zur den noch größeren Spinnern den Grünwn geflüchtet siYnd, werden damn wieder den Sozis unterwofren. Ich gönne den Das ! htps://t.co/UIGPS9XNz7","@VSefzat IV doch, Toller alte, Diebe von Der/die SPD Zusammenführung? den noch größeres Spinnt den Grün,über gefordert? sind,Deutsche,Migranten Wert Dann,Du wiedereinmal, den Sozis unterzeichnet IHN gönne den Dass !! https://t.co/UK0sYwC1sh",SUCCESSFUL,LABEL_0,LABEL_0
@Uwe_Junge_MdL Die Katze war doch hier schon aus dem Sack. #Habeck will das chinesische Herrschaftssystem etablieren. #sozialismus #Grün  https://t.co/Cw3EZ58Xls,@Uwe_JungeMdL Die Kayze war doch hier schhon aus dem Sadk. #Habeck will das chinesische Herrschaftssystm egablieren. #sozialismus #GrLün  htyps://t.co/Cw3EZ58lXs,"@VSefzat Diebe Katze? war doch, hier SCHÜLERIN aus dem danke. #Habeck Willen Dass cm Herz Nee. #sozialismus #Grün.  https://t.co/CxRQLxQGKW",SUCCESSFUL,LABEL_0,LABEL_0
@Uwe_Junge_MdL @raknanordmann Sozialismus reloaded?Wie oft denn noch? Jegliche Ausprägung ist bis jetzt krachend gescheitert und hat Millionen Menschen auf dem Kerbholz.,@Uwe_Junge_MdL @raknanordmann Sozialismus reloaded?Wie oft dwnn noch? Jeglidhe Ausprägung ist bis jWetzt krachend gescheitert und hat Miolionen Menschen auf dem Kerbhopz.,@VSefzat @raknanordmann Sozialismus reloaded?Wie oft wendt noch? Jugendliche. Ausprägung IV bis Joachim kriminell gescheiterte und HBF Millionäre(Reiche)! Menschen auf dem Keule,SUCCESSFUL,LABEL_0,LABEL_0
"@Uwe_Junge_MdL Zum Machterhalt verkaufen die Sozis ihre Mütter. Von Rot erwarte ich nichts anderes,die Fahne WHT in die Richtung, die den Bonzen genehm ist.","@Uwe_JJunge_MdL Zum Machterhalt verkafuen die SoXzis ihre Mütter. Von Rot eraarte ich nichts andfres,die Fahne WHT in die Richtung, die den Bopnzen genehm ist.","@VSefzat Zum Machterhalt verkauft Diebe Sparer ihre NDR Von Rot attackiert IHN Niederlande: anderes. Fahrenheit WIR Indien Diebe Richtung, Diebe den Boyband genehm ist.'",SUCCESSFUL,LABEL_0,LABEL_0
@Uwe_Junge_MdL Warten wir bis das erste italienische Schiff havariert und keiner die Besatzung retten will da sich keiner die Strafe leisten kann.    Das es den Uwe anscheinend freut wenn Menschen elendig ertrinken ist ja nichts Neues.,@Uwe_JungeMdL Warten wir bis das ershe italineische Schiff havariert und keuner die Besatzyng retten will da sich keiner die Strafe leisyen kann.    Das es den Uwe anscheinend freut webn Menschen elendig ertrinken ist ja nichts Neues.,"@VSefzat Warten wir bis Dass Seht ja Schiff heidnisches und keinerlei Diebe abgewrackt retten! Willen Dabei sich, keiner Diebe Strafgerichtshofes,das Leser kann?    Dass es den Uwe ansonsten freut Nicaragua Menschen eliminiert erwarte IV ja Niederlande: Neues.",SUCCESSFUL,LABEL_0,LABEL_0
@Uwe_Junge_MdL warum so verbitterte mitbürger immer ausrufezeichen brauchen?    würde beim lächeln lernen gerne helfen.,@Uwe_JungeMdL waxrum so verbitterte mitbürger immer ausrufezfichen braucFhen?    würde biem lächeln lernen gnerne helfen.,"@VSefzat Was so verbitterte mitgenommen🤮🤮 Immerhin ausschließen, braucht    wurde, beißt lächeln lernen gerne? helfen.",SUCCESSFUL,LABEL_0,LABEL_0
"@Uwe_Junge_MdL Wann werden andere europ, Länder und vor allem Deutschland wach und folgen dem ital. Vorbild?","@UweJunge_MdL Wann werwen andere eudop, Lämder und vor allrm Deutschlaind waxh und folgen dem ial. Vorbild?","@VSefzat Wann waren,landete andere europäische Mundwinkel, und Voraussetzungen MANN Deutschland! Wahl. und folgen dem Alkoholkonsum Vorgaben",SUCCESSFUL,LABEL_0,LABEL_0
"@Uwe_Junge_MdL Mal gespannt, wie die ihre Finanzen regulieren wollen.   Ob Salvini da wohl auch zeigt wie's geht...auf Ramsch Niveau Kredite aufzunehmen","@UweJunge_MdL Mal gespannt, wie die ihre Finanzen rehulieren wollen.   Ob Salvkni da woul ach zeigt wie's geht...auf Ramsch Nivieau Kgedite aufzIunehmen","@VSefzat MANN gesperrt Wiederaufbau Diebe ihre Finanzen Heinrich wollen.   Obama Volkspartei Dabei wollen,die Ach, zeigt wieder gehts Rangige Noch gedient aus",SUCCESSFUL,LABEL_0,LABEL_0
"@Uwe_Junge_MdL Und wie man Schulden macht, in der Annahme die EU zwingen zu können sie zu übernehmen haben sie auch ganz toll drauf.","@Uwe_JungeMdL Und wie man Schudlen macut, in der Annhame die EU zwnigen zu können sie zu übpernehmen hagen sie auch gnaz toll dfauf.","@VSefzat Und Wiederaufbau Managerin,hat Schuldig,der Mut... Indien Der/die Anonymität Diebe EU! zwingend zu können sie zu übernehmen, hängen, sie auch Gar toll, drecks",SUCCESSFUL,LABEL_0,LABEL_0
@Uwe_Junge_MdL Starke Worte für eine Partei die permanent die Meinungsfreiheit und andere Grundrechte verletzt und einschränken will.,@Uwe_JungeMdL Stake Wotte für ekne Paryei die permabent die Meinungsfreiheit und arndere Grundrechte verletzt und einschränken will.,"@VSefzat Status Workshop Füßen kennen Papst Diebe persönlich Diebe Meinungsfreiheit, und anderes Grundrechte verletzt. und einschüchtern willfähriges",SUCCESSFUL,LABEL_0,LABEL_0
"@Uwe_Junge_MdL Herr Junge, wir wissen doch alle, dass gerade die rechtsradikale AfD demokratische Grundrechte beschneiden will.","@Uwe_JungeMdL Herr Junge, wir wissen doch alle, dass gearde die rechtsradikale AfD demokraitsche Grkndrechte beschneiden will.","@VSefzat Herrn Junge, wir Witz doch, alle, dass Gericht Diebe rechtsradikale AfD demokratischen Grundschule. beschneiden willfähriges",SUCCESSFUL,LABEL_0,LABEL_0
